{
  "clause_dispositions": [
    {
      "clause_id": "r007-c001",
      "kind": "context",
      "requirement_ids": []
    },
    {
      "clause_id": "r007-c002",
      "kind": "context",
      "requirement_ids": []
    },
    {
      "clause_id": "r007-c003",
      "kind": "normative",
      "requirement_ids": [
        "req-r007-001",
        "req-r007-002",
        "req-r007-003",
        "req-r007-004"
      ]
    },
    {
      "clause_id": "r007-c004",
      "kind": "normative",
      "requirement_ids": [
        "req-r007-001"
      ]
    },
    {
      "clause_id": "r007-c005",
      "kind": "normative",
      "requirement_ids": [
        "req-r007-001",
        "req-r007-002",
        "req-r007-003",
        "req-r007-004"
      ]
    },
    {
      "clause_id": "r007-c006",
      "kind": "context",
      "requirement_ids": []
    },
    {
      "clause_id": "r007-c007",
      "kind": "example",
      "requirement_ids": [
        "req-r007-001",
        "req-r007-002",
        "req-r007-003",
        "req-r007-004"
      ]
    },
    {
      "clause_id": "r007-c008",
      "kind": "example",
      "requirement_ids": [
        "req-r007-002",
        "req-r007-003",
        "req-r007-004"
      ]
    },
    {
      "clause_id": "r007-c009",
      "kind": "context",
      "requirement_ids": []
    },
    {
      "clause_id": "r007-c010",
      "kind": "normative",
      "requirement_ids": [
        "req-r007-005"
      ]
    },
    {
      "clause_id": "r007-c011",
      "kind": "example",
      "requirement_ids": [
        "req-r007-005",
        "req-r007-006"
      ]
    },
    {
      "clause_id": "r007-c012",
      "kind": "context",
      "requirement_ids": []
    },
    {
      "clause_id": "r007-c013",
      "kind": "normative",
      "requirement_ids": [
        "req-r007-005"
      ]
    },
    {
      "clause_id": "r007-c014",
      "kind": "context",
      "requirement_ids": []
    },
    {
      "clause_id": "r007-c015",
      "kind": "normative",
      "requirement_ids": [
        "req-r007-005",
        "req-r007-006",
        "req-r007-007",
        "req-r007-008"
      ]
    },
    {
      "clause_id": "r007-c016",
      "kind": "normative",
      "requirement_ids": [
        "req-r007-006",
        "req-r007-007",
        "req-r007-008"
      ]
    },
    {
      "clause_id": "r007-c017",
      "kind": "normative",
      "requirement_ids": [
        "req-r007-006",
        "req-r007-007",
        "req-r007-008",
        "req-r007-009"
      ]
    },
    {
      "clause_id": "r007-c018",
      "kind": "context",
      "requirement_ids": []
    },
    {
      "clause_id": "r007-c019",
      "kind": "normative",
      "requirement_ids": [
        "req-r007-010"
      ]
    }
  ],
  "instruction_sha256": "36a650ec3318654c889cb1cfea780b74dbd67b385179bd594950320913bd7376",
  "ir_version": 2,
  "operations": [
    {
      "id": "req-r007-001",
      "modality": "must",
      "operation": "revise",
      "semantic_key": "lineage.step_io_mapping",
      "source_clause_ids": [
        "r007-c003",
        "r007-c004",
        "r007-c005",
        "r007-c007"
      ],
      "spec": {
        "algorithm": [
          "For each configured step, resolve inputs in the exact order declared for its type.",
          "For manifest, resolve no inputs, ignore dir for lineage-node and edge construction, and resolve output from the output field.",
          "Resolve the output field for every non-terminal mapped type.",
          "For verify, set output to null and treat the step as terminal."
        ],
        "defaults": [],
        "edge_cases": [
          "Manifest scans a directory but the directory is not modeled as a file input node.",
          "Verify has no output."
        ],
        "errors": [],
        "examples": [
          {
            "input": "{\"type\":\"manifest\",\"dir\":\"output_dir\",\"output\":\"manifest.json\"}",
            "name": "manifest step mapping",
            "notes": "The dir value is ignored by lineage graph construction.",
            "output": "{\"index\":1,\"type\":\"manifest\",\"inputs\":[],\"output\":\"manifest.json\"}"
          }
        ],
        "formatting": [],
        "formulas": [],
        "input_schema": [
          {
            "key": "ingest",
            "value": "input = field file; output = field output."
          },
          {
            "key": "transform",
            "value": "inputs = fields input then recipe; output = field output."
          },
          {
            "key": "profile",
            "value": "input = field input; output = field output."
          },
          {
            "key": "compare",
            "value": "inputs = fields left then right; output = field output."
          },
          {
            "key": "manifest",
            "value": "inputs = empty array []; output = field output. The dir field is not a lineage input."
          },
          {
            "key": "verify",
            "value": "inputs = fields file then checksum; output = none."
          },
          {
            "key": "validate",
            "value": "inputs = fields input then schema; output = field output."
          },
          {
            "key": "drift",
            "value": "inputs = fields baseline then current; output = field output."
          }
        ],
        "integration": [
          {
            "key": "supported_step_types",
            "value": "ingest, transform, profile, compare, manifest, verify, validate, drift"
          }
        ],
        "interface": [],
        "invariants": [
          "A manifest step has no lineage inputs and retains its output.",
          "The manifest dir value is never treated as an input node."
        ],
        "notes": [
          "The ingest mapping continues to use the field named file as specified by the active lineage contract."
        ],
        "ordering": [
          "Within a step, inputs are ordered as listed: transform input,recipe; compare left,right; verify file,checksum; validate input,schema; drift baseline,current.",
          "Manifest inputs are exactly the empty array []."
        ],
        "output_schema": [],
        "preconditions": [],
        "summary": "Map each supported pipeline step type to its exact lineage input fields and optional output field, treating manifest as an output-only step with no lineage inputs."
      },
      "target_id": "req-r005-007"
    },
    {
      "id": "req-r007-002",
      "modality": "must",
      "operation": "revise",
      "semantic_key": "lineage.nodes",
      "source_clause_ids": [
        "r007-c003",
        "r007-c005",
        "r007-c007",
        "r007-c008"
      ],
      "spec": {
        "algorithm": [
          "Resolve each step's inputs and output using the active lineage step-I/O mapping.",
          "Collect every resolved input path and every non-null output path.",
          "Deduplicate paths by exact string equality.",
          "For each unique path, set type to file and produced_by to its producing step index, or null if it is only an external input.",
          "For a manifest step, include its output path with produced_by set to the manifest step index, but do not include its dir value.",
          "Do not create an output node for a step whose output is null."
        ],
        "defaults": [],
        "edge_cases": [
          "A path mentioned only as a resolved input has produced_by=null.",
          "A verify step contributes its file and checksum inputs but no output node.",
          "A pipeline containing only {\"type\":\"manifest\",\"dir\":\"output_dir\",\"output\":\"manifest.json\"} has exactly one node: manifest.json with produced_by=1."
        ],
        "errors": [],
        "examples": [
          {
            "input": "{\"type\":\"manifest\",\"dir\":\"output_dir\",\"output\":\"manifest.json\"}",
            "name": "manifest-only nodes",
            "notes": "No output_dir node is emitted.",
            "output": "[{\"id\":\"manifest.json\",\"type\":\"file\",\"produced_by\":1}]"
          }
        ],
        "formatting": [],
        "formulas": [],
        "input_schema": [],
        "integration": [
          {
            "key": "step_mapping",
            "value": "Use req-r007-001 to resolve inputs and outputs."
          }
        ],
        "interface": [],
        "invariants": [
          "Each exact resolved path occurs at most once in nodes.",
          "Every node's type is file.",
          "A manifest dir value is not a lineage node.",
          "A manifest output remains a lineage node."
        ],
        "notes": [],
        "ordering": [],
        "output_schema": [
          {
            "key": "nodes",
            "value": "Array containing one object per unique resolved input or non-null output path across all analyzed steps."
          },
          {
            "key": "nodes[].id",
            "value": "String file path."
          },
          {
            "key": "nodes[].type",
            "value": "Literal string file."
          },
          {
            "key": "nodes[].produced_by",
            "value": "The 1-based index of the step producing the path, or null when no analyzed step produces it."
          }
        ],
        "preconditions": [],
        "summary": "Emit one file node for every resolved lineage input or output path, excluding manifest dir values while retaining manifest output nodes."
      },
      "target_id": "req-r005-008"
    },
    {
      "id": "req-r007-003",
      "modality": "must",
      "operation": "revise",
      "semantic_key": "lineage.edges",
      "source_clause_ids": [
        "r007-c003",
        "r007-c005",
        "r007-c007",
        "r007-c008"
      ],
      "spec": {
        "algorithm": [
          "Resolve each step's inputs and output using the active lineage step-I/O mapping.",